major,track,course_code,course_title_en,course_title_ar,credits,prerequisites,description,,
IS,is_required,CPIS250,Software Engineering,?? ????,3,STAT158,"The objective of this course is to introduce  the basic concepts and required skills for  software engineering. It covers the basic  concepts and skills required for developing  large scale applications that take long  periods of time. The course presents the  latest methods and techniques used in  software engineering obtained from the  actual practice in the field as well as latest  advances accomplished by specialist research centers. Also, it particularly  emphasizes on the role of team work on  developing software and the skills required  to work as part of a team. Topics include  foundation for systems development,  methodologies of IS development, software  process models, process iteration, process  activities, project management, project  scope, project management life cycle,  managing IS project, planning IS project,  feasibility study of IS project, models of  software development, determining system  requirements (functional and non-functional  requirements), data modeling and E-R-D  model, object-oriented analysis and  modeling, systems structure modeling,  object, class, attributes, methods, classes  relationships, generalization, specialization,  association, class diagrams, object-oriented  analysis and modeling.  ",,
IS,is_required,CPIS312,Information & Computer Security,?? ????,3,STAT159,"The objective of this course is to equip  students with the scientific and  mathematical concepts and skills related to  information security. Topics include the  security of information and software  systems, including attacks and data  encryption, mathematical foundations,  algorithms of cryptography, ways of  distributing keys, techniques of data  protection over computer networks, and  controlling access using passwords.  ",,
IS,is_required,CPIS323,Summer (Workplace) Training,?? ????,0,STAT160,"This is mandatory, 200-hour internship  program for all FCIT students. The objective  of this course is to provide students the  opportunity to apply their academic  education with hands-on, real world  experience in a work setting. Students are  sent to different companies to get the real  flavor of work group, communications, and  professional development experiences. ",,
IS,is_required,CPIS342,Data Warehousing and Mining,?? ????,3,STAT161,"The objective of this course is to study the  basic concepts of data mining & warehousing  and the required skills to develop and use  them. It emphasizes on employing data  warehousing to support the decision-making  process. It also covers the architectures of  data warehousing and the infrastructural  settings to develop them. It explains various  ways of extracting, analyzing data to support  the decision-making process. This course is  intended to develop the student’s ability to  extract information from data and identify  patterns and trends by designing a data  warehouse and by applying data mining  methods for classification, clustering, and  association analysis. ",,
IS,is_required,CPIS351,IS Analysis & Architecture Design,?? ????,3,STAT162,"The objective of this course is to introduce  methods used in IS analysis in order to  identify and characterize needs and to  automate and create computer systems for  them. The automated systems incorporate  several technologies, and this course studies  the way making optimum use of such  systems for the users' service. The course  emphasizes on the design phase activities  and also presents design using structural and  object-oriented techniques. Topics include  system architectures design, traditional  approach to design, object-oriented  approach to design for applications,  designing files and database, designing the  user interface, designing the system  interface and prototyping, controls and  security, implementation, and support  issues.  ",,
IS,is_required,CPIS352,IS Applications Design & Development,?? ????,3,STAT163,"The objective of this course is to explore the  design, selection, implementation, and  management of enterprise IT solutions. The  focus is on applications and infrastructure  and their fit with the business. Topics include  frameworks and strategies for infrastructure  management, system administration,  data/information architecture, content  management, distributed computing,  middleware, legacy system integration,  system consolidation, and software  selection, total cost of ownership calculation,  IT investment analysis, and emerging  technologies. These topics are addressed  both within and beyond the organization,  with attention paid to managing risk and  security within audit and compliance  standards. Students also hone their ability to  communicate technology architecture  strategies concisely to a general business  audience.  ",,
IS,is_required,CPIS354,Principles of Human Computer Interaction,?? ????,3,STAT164,"The objective of this course is to provide an  introduction to the field of systems provides the students with  knowledge to understand what influences  usability and acceptance of IS. Topics include  the examination of human performance,  components of technology, methods and  techniques used in design and evaluation of  IS, societal impacts of HCI, user-centered  design methods, and the contemporary  technologies used in empirical evaluation  methods.  ",,
IS,is_required,CPIS357,Software Quality and Testing,?? ????,3,STAT165,The objective of this course is to study the  significance of quality during the process of  developing software. Topics include the  basic concepts of software quality assurance  during all the stages of software  development process and quality standard  systems used in the field of software industry  and Information Systems.  ,,
IS,is_required,CPIS358,Internet Applications & Web Programming,?? ????,3,STAT166,"The objective of this course is to equip  students with the necessary knowledge to  design and implement Internet applications.  Topics include the specific technologies of  these applications, how to employ them in  building effective and efficient applications,  the technical characteristics of the Internet  protocols, the various structures of Internet based application development, and the  organization and security of business  transactions conducted over intranets. ",,
IS,is_required,CPIS370,Fundamentals of Data Networks,?? ????,3,STAT167,"The objective of this course is to provide an  introduction to IT infrastructure issues for  students majoring in Information Systems. It  covers topics related to both computer and  systems architecture and communication  networks, with an overall focus on the services and capabilities that IT  infrastructure solutions enable in an  organizational context. It gives the students  the knowledge and skills that they need for  communicating effectively with  professionals whose special focus is on  hardware and systems software technology  and for designing organizational processes security, business continuity, and the role of  infrastructure in regulatory compliance.",,
IS,is_required,CPIS380,Introduction to E Business Systems,?? ????,3,STAT168,"The objective of this course is to study the  marketing implications of the e-business  systems. Topics include impact on  information systems within a business,  impact on business design and strategy,  impact on the industries and markets, and  business models for e-business.  ",,
IS,is_required,CPIS434,IS Strategies and Policies,?? ????,3,STAT169,"The objective of this course is to study the  processes, methods, techniques, and tools  that organizations use to manage their  information systems projects. The course  covers a systematic methodology for  initiating, planning, executing, controlling,  and closing projects. This course assumes  that project management in the modern  organization is a complex team based  activity, where various types of technologies  (including project management software as  well as software to support group collaboration) are an inherent part of the  project management process. This course  also acknowledges that project management  involves both the use of resources from  within the firm, as well as contracted from  outside the organization. ",,
IS,is_required,CPIS498,Senior Project (I),?? ????,1,STAT170,"This course is the first part of a sequence of  two courses that constitute the graduation  
capstone project. In this part, the student is  expected to propose, analyze, and design a  software system or conduct a thorough  investigation of a particular IS-related  problem for research-based projects. The  student will deliver oral presentations and  written reports. ",,
IS,is_required,CPIS499,Senior Project (II),?? ????,3,STAT171,"This course is the second part of a sequence  of two courses that constitute the graduation  capstone project. In this project, the student  will continue the System/Research  development of the project that started in  CPIS-498. The student will deliver oral  presentations, progress reports, and a final  report. ",,
IS,is_desicision_support_systems,CPIS420,Techniques of Decision Support Systems,?? ????,3,STAT172,"The objective of this course is to extend the  basic knowledge of DSS covered in the CPIS 320 by studying practical techniques and  methods for DSS. Coupled with classical  approaches, the course explores the latest  techniques available for extracting suitable  and relevant information to support making  a wide range of decisions from day to day  structured decisions, to complex  unstructured decisions. In addition, the  course also covers intelligent systems in  particular relation to DSSs.  ",,
IS,is_desicision_support_systems,CPIS424,Modeling and Simulations,?? ????,3,STAT173,"The objective of this course is to develop the  student’s ability to understand the basic  concepts in modeling and simulation and  develop discrete event simulation models.  Topics include basic simulation modeling,  simulation input and output analysis,  validation and verification of simulation  models, and building simulation models  using Arena and MS Excel.  ",,
IS,is_desicision_support_systems,CPIS363,Intelligent Systems,?? ????,3,STAT174,The objective of this course is to equip  students with the required skills to be able to  access information and be able to use it  efficiently through using intelligent systems  that lead to success and economic  superiority. This course will cover the  necessary concepts and techniques that  facilitate developing intelligent systems used  in business applications.  ,,
IS,is_desicision_support_systems,CPIS490,Selected Topics in IS*,?? ????,3,STAT175,The objective of this course is to explore  selected topics concerning the latest  advancements in the field of Information  Systems (topics determined by the Council of  the Information Systems Department).  ,,
IS,is_e_system_development,CPIS382,Dev of E Systems & Interface Design,?? ????,3,STAT176,"The objective of this course is to introduce  techniques that are useful stand-alone and  can be integrated for building a semantic  web. Topics include semantic web  technologies, data modeling languages such  as XML, XML SCHEMA, domain modeling  languages such as RDF, RDF Schema,  ontology modeling languages such as OWL,  query languages such as XQuery and SPRQL.  Also students will use tools such as Stylus  studio and Protégé in their modeling.  ",,
IS,is_e_system_development,CPIS483,E Systems Applications,?? ????,3,STAT177,"The objective of this course is to provide  broad understanding of various e-system  Web applications and to identify the role  these E-Systems play in the development  process of institutions and the society.  Topics/applications include social networks,  e-Learning, e-government, mobile  computing, pervasive computing, e-CRM, E Auctions, E-Supply chain, and support  technology concepts such Web 2.0  applications, web services, and cloud  computing.  ",,
IS,is_e_system_development,CPIS486,E Business Strategies,?? ????,3,STAT178,"The objective of this course is to explore e business strategies for Information systems  and the infrastructure required for web based business models. Topics include E Business and virtual organizations,  
characteristics of virtual organizations, e business models, globalization on SME e business, strategy evaluation to change e business, virtual infrastructure, culture to administrative and technical concepts of the  transformation process to office automation  and the significance of the human impact  during this process.  ",,
IS,is_e_system_development,CPIS363,Intelligent Systems,?? ????,3,STAT179,"The objective of this course is to explore e business strategies for Information systems  and the infrastructure required for web based business models. Topics include E Business and virtual organizations,  
characteristics of virtual organizations, e business models, globalization on SME e business, strategy evaluation to change e business, virtual infrastructure, culture to  administrative and technical concepts of the  transformation process to office automation  and the significance of the human impact  during this process. ",,
IS,is_e_system_development,CPIS490,Selected Topics in IS*,?? ????,3,STAT180,The objective of this course is to explore  selected topics concerning the latest  advancements in the field of Information  Systems (topics determined by the Council of  the Information Systems Department). ,,
IT,it_required,CPIT201,Introduction to Computing,????? ?? ???????,3,STAT181,"The objective of this course is to present computer
science subject areas and applications in ways that
serve to motivate the study of computer science
and to put into context the various subjects that
students encounter later in their studies. Topics
include an introduction to the discipline of
computing, computer systems, number systems,
data representation, basic computer organization,
operating system functionality, basics of
networking, the Internet, an overview of database
systems, models, software engineering
methodologies, and programming languages.",,
IT,it_required,CPIT240,Database (I),????? ???????? (?),3,STAT182,"This course is the first in a series of courses on
designing and implementing database information
systems. The objective of this course is to prepare
students to become able to implement a working
database system using one of the popular
commercial DBMSs. Topics include data and
information, file system, database and database
users, database system concepts and architecture,
data modeling using the entity relationship (ER)
model, the relational data model and relational
database constraints, functional dependencies and
normalization for relational databases, relational
algebra and relational calculus, relational database
design by ER and EER to relational mapping, disk
storage, basic file structure and hashing, SQL-99
schema definition, constraints, queries, and views.",,
IT,it_required,CPIT220,Introduction to IT,????? ?????,3,STAT183,"The objective of this course is to provide an
overview and understanding of the conceptual
base of Information Technology, introducing the
newly specialized IT students with the knowledge
and skills related to understanding existing and
emerging information technologies. Students will
find this a helpful Bridge course to upper level
courses in Information Technology. This course is
supported with a laboratory that aims to equip
students with practical knowledge and
presentation skills. The purpose of this course is
threefold: (1) to provide comprehensive and
engaging overview of cutting edge information
technologies, (2) to identify and discuss
fundamental principles underlying these
technologies, and (3) to relate these technologies
to practical life. Topics include an introduction to
information technology, digital and analog signals,
inside the system unit, system software, databases
and information systems, system analysis and
design, information systems and databases,
networking, privacy, crime and security.",,
IT,it_required,CPIT210,Computer Organization & Architecture,????? ?????? ??????,3,STAT184,"The objective of this course is to provide an
introduction to basic computer organization.
Topics include binary, hexadecimal, and decimal
number conversions, binary number arithmetic,
laws of Boolean algebra, basic computer logic,
gates, combinational circuits, sequential circuits,
adders, counters, registers, decoder, encoder,
comparator, multiplexer, computer organization
buses and computer architecture, cache memory,
computer arithmetic, instruction sets, and
addressing modes.",,
IT,it_required,CPIT250,System Analysis & Design ,????? ? ????? ??????,3,STAT185,"The objective of this course is to provide a
methodical approach to developing computer
systems, including systems planning, analysis,
design, and implementation. The course
approaches the development of information
systems from a problem-solving perspective,
placing emphasis on the strategies and techniques
of systems analysis and design for producing
logical methodologies for dealing with complexity
in the development of information systems.",,
IT,it_required,CPIT260,Operating Systems,??? ?????,3,STAT186,"The objective of this course is to provide an
introduction to the basic concepts of modern
operating systems. The course covers the design of
operating systems and the way they work, in
terms of efficiency and reliability, in addition to
comparing between the techniques used inside
the operating systems, in terms of time and space
complexity. Topics include the basic components
of different operating systems, organizing and
managing processes, computing synchronization,
different scheduling techniques for processors,
storage devices, memory management, file
systems, and input/output systems.",,
IT,it_required,CPIT285,Computer Graphics ,???? ????,3,STAT187,"The objective of this course is to study the
hardware and software principles of interactive
raster graphics. Topics include an introduction to
the basic concepts of computer graphics, vector
and pixel displaying system, basic computer
graphics techniques, graphical software, the use of

API(s) for computer graphics, color models,
coordinates homogeneous, transformation,
rotation, clipping, representation of objects

through polygons, two-dimensional and three-
dimensional computer graphics techniques,

coordinate transformations, drawing curves and
surfaces, shading and lighting models, graphics
devices, animation techniques, ray tracing, and the

design and drawing of two-dimensional and three-
dimensional graphics objects in OpenGL in C++.",,
IT,it_required,CPIT251,Software Engineering (I),????? ??????? (?),3,STAT188,"The objective of this course is to study software
engineering principles and techniques used in the
specification, design, and testing of software
systems. Major software development
methodologies are reviewed including
requirements, analysis and specification, design,
testing, and documentation.",,
IT,it_required,CPIT280,Human Computer Interaction ,????? ??????? ???????,3,STAT189,"The objective of this course is to study the
fundamentals and principles of human computer
interaction. Also, it is intended to develop the
student's ability to explore and implement a
usable design, in addition to measure, analyze, and
evaluate the human computer interaction systems",,
IT,it_required,CPIT370,Computer Networks,?????,3,STAT190,"The objective of this course is to provide a wide
background of computer networks, giving students
the basic knowledge of data communication,
medium accessing protocols, local area networks,
and an overview of the higher level protocols.
Topics include principles of computer networks,
network standard models, analog and digital
signals, multiplexing schemes, transmission media,
multiple access techniques, wired and wireless
lans, network devices, IP addressing, domain name
system, and laboratory experiments.",,
IT,it_required,CPIT252,Software Design Patterns ,????? ????? ?????????,3,STAT191,"The objective of this course is to study the
principles behind the patterns of software and to
then apply a number of basic patterns. This course
covers fundamental aspects of large scale software
architecture, defined frameworks, design patterns,and ways of developing and establishing systems
based on components. The purpose of this course
is: (1) to know the classical styles of software
pattern and the need for a language to describe
the architecture, (2) to understand how to express
the qualities we want our architecture to provide
to the system or systems we are building from it,
and (3) to know how to achieve software qualities
using TACTICS. Topics include envisioning
architecture (architecture business cycle),
architectural patterns, reference models,
reference architectures, understanding quality
attributes, achieving qualities using tactics, and
how to document software architecture.",,
IT,it_required,CPIT330,IT Issues & Management ,????? ????????? ????????,3,STAT192,"The objective of this course is to study the
concepts and application of Agile and Scrum
techniques to manage software development
projects. Topics include an introduction to agile
project management, fundamentals of Scrum for
dealing with uncertainty and risk, identifying the
roles and their responsibilities, managing releases,
tools for tracking and monitoring a project,
planning an agile project, establishing the business
reasons for the project, clarifying the business
vision, identifying features for development in an
iteration, fostering self-management within the
development team, creating the optimal working
environment, transitioning to self-management,
running iterations, managing change, reviewing
the iteration through a sprint review, closing the project using a sprint retrospective, applying agile
throughout your organization, dealing with the
legacy organization, and scaling for large projects.",,
IT,it_required,CPIT380,Multimedia Technologies ,??????? ????? ???????,3,STAT193,"The objective of this course is to study multimedia
technologies and programming methods to
manipulate multimedia. Topics include creating
and modifying images, modifying sounds, splicing
words into sentences, reversing sounds, writing
programs to generate dynamic web-pages from
databases, and creating animations and movies
with special effects.",,
IT,it_required,CPIT305,Advanced Programming ,????? ??????,3,STAT194,"The objective of this course is to study advanced
techniques in Java programming. Topics include
how to build applications for different purposes,
methods for Java programs to interact with other
existing technologies, exception and error
handling, streams and files operations, concurrent
programming, network and socket programming,
and Java Database Connectivity (JDBC).",,
IT,it_required,CPIT425,Information Security ,??? ?????????,3,STAT195,"The objective of this course is to provide basic
knowledge on the technical and operational issues
of modern cryptosystems and the related
standards. Topics include threats to network
security and schemes for breaking security,
classical encryption techniques, block ciphers and
stream ciphers, DES and triple DES, AES, block
cipher operation modes, asymmetric ciphers: RSA,
Diffie-Hellman key exchange, ElGamal
cryptosystem, hash functions, MAC functions,
digital signature, key management and
distribution, X.509 certificates, transport level
security: SSL and TLS, Intrusion, and types and
configurations of firewalls.",,
IT,it_required,CPIT405,Internet's Applications,??????? ????????,3,STAT196,"The objective of this course is to study internet
programming and web-application development.
Students will learn basic principles and techniques
for building internet applications. It provides
students with the basic web-page development

technologies and an introduction to dynamic web-
page development using client-side scripting.

Topics include introduction to HTTP protocol and
client side programming, XHTML, Cascading Style
Sheets, JavaScript DOM, XML (Name space, DTD,
Schema, XSLT, XPATH), RSS, and AJAX.",,
IT,it_required,CPIT498,Senior Project (1),????? ???? (?),1,STAT197,"This course is the first part of a sequence of two
courses that constitute the graduation capstone
project. In this course the students integrate the
knowledge areas of IT into a development-based
project in which they deliver proposals, reports,
and oral presentations. The course topics cover
planning, analysis, and design phases of the
projects.",,
IT,it_required,CPIT345,Database Administration ,????? ????? ????????,3,STAT198,"The objective of this course is to explore a variety

of topics in Database Administration. Using hands-
on training, students will learn about installation,

configuration, administration, performance,
security, backup and recovery, and enterprise
services of databases. Additional topics include an
introduction to DBMS, schemas objects,
partitioned tables and indexes, built in data types,
backup and recovery, enterprise tools, services
and connectivity, locking, and concurrency.",,
IT,it_required,CPIT435,Needs Assessment & Technology Evaluation ,????? ?????????? ? ???????????,2,STAT199,"The objective of this course is to explore the
methods of identifying organizational needs.
Topics include the types of the questions expected
in personal interviews, the needed skills in how to
identify and assess appropriate technology to
meet the needs of the business, and how to follow
up, make changes, and find updated technical
solutions with the development and renewal
requirements in the future.",,
