major,track,course_code,course_title_en,course_title_ar,credits,prerequisites,description,,
IT,it_required,CPIT499,Senior Project (2),????? ???? (?),3,STAT200,"This course is the second part of a sequence of
two courses that constitute the graduation
capstone project. This course aims to execute
what was presented in CPIT-498 – the students
present two reports and two presentations of the
graduation project. The courses topics cover detail
design, coding, testing, and project
implementation.",,
IT,it_required,CPIT470,Networks Administration ,????? ???????,3,STAT201,"The objective of this course is to explore the
principles of network administration. Topics
include network OSI layers and CISCO IOS
configuring devices, IP addressing and subnetting,
introduction to routing, static routing, default
routing, dynamic routing, RIP1 and RIP2,
troubleshooting, routing table lookup process,
OSPF, switching & switch configuration, switch
security, VLANs, spanning tree protocol, VTP, inter
VLAN routing, and network troubleshooting.",,
IT,it_required,CPIT323,Summer Training (I),??????? ??????,0,STAT202,"This is mandatory, 200-hour internship program
for all students in FCIT. The objective of this course
is to provide students the opportunity to apply
their academic education with hands-on, real
world experience in a work setting. Students are
sent to different companies to get the real flavor
of work group, communications, and professional
development experiences.",,
IT,it_required,STAT210,Introduction to computing Statistics,????? ????????,3,STAT203,NONE,,
IT,it_required,CPIT221,Technical Writing ,?????? ?????,2,STAT204,"The objective of this course is to study the
fundamentals of technical communication. Topics
include the concepts of technical communication
and its differences with academic writing,
processes in technical communication, tools and
techniques to perform collaborative projects and
writing, formatting the technical documents with
modern tools and techniques, techniques to write
official letters, memos and e-mails, writing
definitions and descriptions, writing informal
reports to address immediate and intermediate
tasks accomplishment, writing formal reports to
portray the complex nature of issues, writing
informal proposals to cover projects with limited
scope, writing formal proposals to submit a
detailed document, normally applied to large
projects, developing presentation skills, preparing
effective CV’s and cover letters, developing skills
for job interviews, learning styles in technical
writing for effective revision, and practicing
professional presentations in a seminar
environment.",,
IT,it_required,CPCS202,Programming (I),????? (?),3,STAT205,"The objective of this course is to cover the
fundamental concepts of procedural programming.
This course introduces the Java programming
language and helps students develop basic
problem-solving skills. Topics include algorithms,
flowchart, API, IDE, and JDK, numerical data,
primitive data type, short hand operators , cast
value of one type to another type , selection
statements, switch statements, break and continue
statements, relational operators, logical operators,
logical expressions, Boolean variable, Boolean
expressions, repetition statements, nested loops,
methods, pass arguments to a method, method
overloading, method abstraction, use of methods in
the math class, arrays, common array operations,
methods with array arguments and return value,
search and sort operations on array.",,
IT,it_required,CPCS203,Programming (II),????? (?),3,STAT206,"The objective of this course is to cover the basic and
intermediate concepts of object oriented
programming. Topics include the use of numerical
data, primitive data types, selection statements,
repetition statements, class, standard classes,
object, instance of a class, object oriented
programming, software development, constructor,
methods, call by values, call by reference, UML,
state memory diagram, class diagram, arrays,
method overloading, constructor overloading,
overriding, this, new, exception and assertions,
Inheritance, encapsulation, data abstraction,
private, public, protected, exception, inheritance,
abstract class, polymorphism, file handling.",,
IT,it_required,CPCS222,Discrete Structures (I),?????? ?????? (?),3,STAT207,"The objective of this course is to study the logical
and algebraic relationships between discrete
objects. This course cultivates clear thinking and
creative problem solving by developing students’
mathematical maturity in several core areas: logic
and proofs, sets, functions, relations, and counting
techniques.",,
IT,it_required,CPCS204,Data Structures (I),?????? ?????? (?),3,STAT208,"The objective of this course is to provide students
an understanding of abstract data structures,
including, but not limited to, arrays, linked lists,
queues, stacks, trees, and graphs. The course also
aims to give a conceptual understanding of the
trade-offs between various data structures, hence
enabling students to choose an optimal data
structure for a particular application. The students
will also learn concepts of algorithmic design,
recursion, and a variety of searching and sorting
algorithms.",,
IT,it_required,CPIS334,Software Project Management ,????? ?????? ??????,2,STAT209,"The objective of this course is to study the  processes, methods, techniques, and tools  that organizations use to manage their  information systems projects. The course  covers a systematic methodology for  initiating, planning, executing, controlling,  and closing projects. This course assumes  that project management in the modern  organization is a complex team based  activity, where various types of technologies  (including project management software as  well as software to support group collaboration) are an inherent part of the  project management process. This course  also acknowledges that project management  involves both the use of resources from  within the firm, as well as contracted from  outside the organization. ",,
IT,it_required,CPIS428,Professional Computing Issues ,????? ??????? ???????,2,STAT210,"The objective of this course is to explore the  ethical and social issues sparked by the ever growing information society at the local and  global level. Topics include the impact of  digitized information on individuals and  societies, privacy, intellectual property,  computer crimes, evaluating and controlling  technology, and professional ethics and  responsibilities. The course also explores the  social impact of information technology in  different areas of human life such as Internet,  information flooding, and the computerized  world, business, medicine, law, government,  transportation, entertainment, education,  banking, e-commerce, communications, an  overview of the law, ownership of software,  software contracts and liability, privacy and  the data protection act, computer misuse,  and forensic, societies for computing  professionals, and professionalism and  ethics.  ",,
IT,it_college_free,CPIT430,Decision Support Systems,??? ??? ??????,3,STAT211,"The objective of this course is to explore the
concept of decision support systems and

components. It gives knowledge of decision-
making models under different circumstances, as

well as identifies the intelligent systems and their
role in the process of decision support. It also
teaches how to deal with crises and disasters using
decision support systems.",,
IT,it_college_free,CPIT436,E Buisness Technology,????? ??????? ???????????,3,STAT212,"The objective of this course is to explore e-
business technology and the use of computer

techniques in updating business processes, which
are designed to improve performance and reduce
costs.",,
IT,it_college_free,CPIT480,Fundamentals of Instructional Techniques,??????? ????? ???????,3,STAT213,"The objective of this course is to study the
planning, organization and development of
educational materials. Also, it uses the instructions
system design model (ISD) to analyze, design,
deliver, and evaluate instructions.",,
IT,it_college_free,CPIT485,User Centered System Design,????? ????? ????????? ??? ????????,3,STAT214,"The objective of this course is to explore the
concepts of instruction between humans and
computers and how to apply the rules of design
and quality assurance in interactive systems.",,
IT,it_college_free,CPIT490,Selected Topics in IT*,?????? ?????? ?? ????? ?????????,3,STAT215,"The objective of this course is to explore selected
topics on the latest advances in the field of
Information Technology (topics determined by the
Council of the Information Technology
Department).",,
IT,it_database,CPIT340,Database (II),????? ?????? (2),3,STAT216,"The objective of this course is to study advanced
topics in the domain of databases. Topics include
distributed databases and client-server
architectures, concepts for object databases,
enhanced data models for advanced applications,
database tuning in relational database systems,
concurrency control techniques, and database
security.",,
IT,it_database,CPIT440,Data Mining and Warehousing,???????? ???????? ????????,3,STAT217,"The objective of this course is to explore the
different knowledge extraction methods and their
representation techniques as well as knowledge
engineering. It also introduces the different basic
artificial intelligence theories that qualify the
students to understand the course contents.
Topics include an introduction to data mining and
warehousing, data warehousing and OLAP
technology, classification and prediction, mining
frequent patterns, associations and correlations,

review of probability and statistics, and data
preprocessing.",,
IT,it_database,CPIT445,Knowledge Engineering,????? ???????,3,STAT218,"The objective of this course is to explore a variety

of topics in Database Administration. Using hands-
on training, students will learn about installation,

configuration, administration, performance,
security, backup and recovery, and enterprise
services of databases. Additional topics include an
introduction to DBMS, schemas objects,
partitioned tables and indexes, built in data types,
backup and recovery, enterprise tools, services
and connectivity, locking, and concurrency.",,
IT,it_network,CPIT375,Data Network Design and Evaluation,????? ?????? ????? ????????,3,STAT219,"The objective of this course is to study the
concepts and practical skills to design and evaluate

data networks. Topics include technical concepts
related to the data networks design, managerial
aspects of the design, and technical skills needed
to evaluate different network technologies,
thereby enabling students to compare and
contrast different alternatives for network designs.",,
IT,it_network,CPIT475,Wireless Data Networks,????? ???????? ?????????,3,STAT220,"The objective of this course is to explore principles
of IT Infrastructure, Networking and System
Administration. Topics include cellular
architecture, GSM, GPRS, UMTS, 802.11 WLAN
infrastructure designing, and planning and
administration.",,
IT,it_software_engineering,CPIT455,Software Engineering (II),????? ????????? (2),3,STAT221,"The objective of this course is to explore software
advanced engineering principles and techniques
used in the specification, design, and testing of
software systems Topics include software
engineering confirmation and authentication,
methods and ways of software testing building
and managing software development teams,
scientific and practical methods for calculating the
costs of software development, quality
management in software development, processes
development in software production, and
reconstruction management in software",,
IT,it_software_engineering,,Software Economics,????????? ?????????,3,STAT222,"The objective of this course is to explore concepts
in software economics. Topics include important
economic concepts in the process of software
development, building and empowering software
development teams, continuous improvement of
procedures in building software process,
production tasks in the process of applications
development, economies of scale operations
related to software development, optimizing
restricted operations and cost estimation to build
software, models of integrated operations, spiral
model to build software, and risk management in
building software.",,
